{
  "$id": "https://filterest.com/schemas/build_identity.v1.schema.json",
  "$schema": "https://json-schema.org/draft/2020-12/schema",
  "additionalProperties": false,
  "allOf": [
    {
      "if": {
        "properties": {
          "channel": {
            "const": "development"
          }
        },
        "required": [
          "channel"
        ]
      },
      "then": {
        "properties": {
          "maturity": {
            "const": "snapshot"
          }
        }
      }
    },
    {
      "if": {
        "properties": {
          "artifact_type": {
            "const": "backup"
          }
        },
        "required": [
          "artifact_type"
        ]
      },
      "then": {
        "properties": {
          "maturity": {
            "const": "snapshot"
          }
        }
      }
    },
    {
      "if": {
        "properties": {
          "maturity": {
            "enum": [
              "candidate",
              "published"
            ]
          }
        },
        "required": [
          "maturity"
        ]
      },
      "then": {
        "properties": {
          "artifact_type": {
            "const": "runtime"
          },
          "channel": {
            "const": "stable"
          }
        }
      }
    }
  ],
  "properties": {
    "app_version": {
      "pattern": "^(0|[1-9][0-9]*)\\.(0|[1-9][0-9]*)\\.(0|[1-9][0-9]*)$",
      "type": "string"
    },
    "artifact_type": {
      "enum": [
        "runtime",
        "backup"
      ]
    },
    "build_id": {
      "pattern": "^filterest-(0|[1-9][0-9]*)\\.(0|[1-9][0-9]*)\\.(0|[1-9][0-9]*)-(development|stable)-(runtime|backup)-[0-9a-f]{12}$",
      "type": "string"
    },
    "channel": {
      "enum": [
        "development",
        "stable"
      ]
    },
    "created_at": {
      "pattern": "^\\d{4}-\\d{2}-\\d{2}T\\d{2}:\\d{2}:\\d{2}Z$",
      "type": "string"
    },
    "database": {
      "additionalProperties": false,
      "properties": {
        "min_version": {
          "pattern": "^(0|[1-9][0-9]*)\\.(0|[1-9][0-9]*)\\.(0|[1-9][0-9]*)$",
          "type": "string"
        },
        "target_version": {
          "pattern": "^(0|[1-9][0-9]*)\\.(0|[1-9][0-9]*)\\.(0|[1-9][0-9]*)$",
          "type": "string"
        }
      },
      "required": [
        "min_version",
        "target_version"
      ],
      "type": "object"
    },
    "ledger_record_id": {
      "pattern": "^build:filterest-(0|[1-9][0-9]*)\\.(0|[1-9][0-9]*)\\.(0|[1-9][0-9]*)-(development|stable)-(runtime|backup)-[0-9a-f]{12}$",
      "type": "string"
    },
    "ledger_record_sha256": {
      "pattern": "^[0-9a-f]{64}$",
      "type": "string"
    },
    "maturity": {
      "enum": [
        "snapshot",
        "candidate",
        "published"
      ]
    },
    "product": {
      "const": "filterest"
    },
    "schema_version": {
      "const": 1,
      "type": "integer"
    },
    "source": {
      "additionalProperties": false,
      "properties": {
        "commit": {
          "pattern": "^[0-9a-f]{40}$",
          "type": "string"
        },
        "model": {
          "enum": [
            "legacy_maintainer_export",
            "public_first"
          ]
        }
      },
      "required": [
        "model",
        "commit"
      ],
      "type": "object"
    }
  },
  "required": [
    "schema_version",
    "product",
    "build_id",
    "ledger_record_id",
    "ledger_record_sha256",
    "app_version",
    "artifact_type",
    "channel",
    "maturity",
    "source",
    "database",
    "created_at"
  ],
  "title": "Filterest generated build identity v1",
  "type": "object"
}
