{"app_version":"8.40.0","artifact_type":"runtime","build_id":"filterest-8.40.0-stable-runtime-2a36d319e5f9","channel":"stable","created_at":"2026-08-22T23:51:48Z","database":{"min_version":"9.6.0","target_version":"9.6.0"},"ledger_record_id":"build:filterest-8.40.0-stable-runtime-2a36d319e5f9","ledger_record_sha256":"44e3dc50ecaaa2a1c725c6ea1eae193ab5bffb30f4a1f959d00940e86c2ad71f","maturity":"candidate","product":"filterest","schema_version":1,"source":{"commit":"2a36d319e5f9c427145b327e87b91e17cd154ac1","model":"legacy_maintainer_export"}}
