{"app_version":"9.4.1","artifact_type":"runtime","build_id":"filterest-9.4.1-stable-runtime-2c5e04302524","channel":"stable","created_at":"2026-10-13T16:40:22Z","database":{"min_version":"9.11.1","target_version":"9.11.1"},"ledger_record_id":"build:filterest-9.4.1-stable-runtime-2c5e04302524","ledger_record_sha256":"0cc011f3327cf885330c6e47ef14e571223889fc6d660b1c4cc4f3ecfd912e5f","maturity":"published","product":"filterest","schema_version":1,"source":{"commit":"2c5e04302524f8f5a4a8e91ab344a5252ec0df88","model":"public_first"}}
